{
  "schemaVersion": 1,
  "sequence": 3,
  "savedAt": "2026-08-27T18:12:27+09:00",
  "actor": "chatgpt-hourly",
  "researchedEdgeId": "misconduct-overreaction-recovery",
  "researchDone": "Known-Bad Event Repricingを独立Edgeから外し、Misconduct Overreaction Recovery Edgeの正式イベント後secondary repricing/timing filterへ統合した。初期shock、実害評価、正式イベント、remediation、回復を1本のissuer timelineで研究し、同一不祥事の二重sample化を防ぐ。旧Known-Bad Edgeはprovenance保持のためdeprecatedとし、独立short Promotionを停止した。",
  "addedAnalogIds": [],
  "rejections": [
    {
      "target": "Known-Bad Event Repricingを独立Research Edgeのまま並行継続する案",
      "reason": "Misconduct Recoveryと母集団、PIT timestamp、known/new facts、confounder、価格系列が大きく重複し、同一不祥事を分断・二重計上するため。"
    }
  ],
  "dataGaps": [
    "不祥事ごとにinitial shockからformal event、remediation、D+120 outcomeまでを同一sample IDで結ぶincident timeline contract",
    "formal eventのknown fact/new fact差分、publicObservedAt、firstExecutableAtのPIT復元",
    "event直前entry、event後first executable、D+1、D+3、D+5のentry timing比較",
    "旧idiosyncratic-shock 27候補と旧Known-Bad候補の重複除去・outcome-blind replay",
    "Sanrio calibration timelineと成功・非回復・悪化・negative controlを含む120件以上のsample",
    "Owner Web UIでResearch Dashboard / Log / Checkpoint / Analog / Outcomeを統合表示するread-only research surface"
  ],
  "nextCandidates": [
    {
      "edgeId": "ex-rights-overreaction-recovery",
      "why": "現在の別系統A優先Edge。AEON/J Trust live observationとhistorical権利落ちuniverseをPIT接続してresidual dropと回復率を実測する。"
    },
    {
      "edgeId": "misconduct-overreaction-recovery",
      "why": "Known-Badを統合した単一不祥事EdgeとしてSanrioをphase1〜phase5へPIT再構成し、旧候補を勝ち事例だけ選ばず移行する。"
    }
  ],
  "openQuestions": [
    "不祥事Edgeのprimary long entryを初期shock open+60m、D0 close、formal event後first executableのどれに事前固定するか。",
    "formal-event secondary repricingが単なるgeneric reversalではなくentry timing改善に寄与するか。",
    "actor separabilityとeconomic damageを人間間で再現できる分類contractへどこまで構造化するか。",
    "旧27候補をexploratory cohortとして使いながらconfirmatory/holdoutへのfuture-return leakageを防ぐ切り分け。"
  ],
  "osIssues": [
    "Research OS正本にはDashboard/Log/CheckpointがあるがOwner Web UIに統合表示がなく研究の途中経過を見つけにくい。Issue #1295でread-only /research surfaceとして追跡する。"
  ]
}
